{
  "schema_version": "1.0.0",
  "idea_id": "motivation_first_action_001",
  "duration_seconds": 53.7,
  "aspect": "9:16",
  "shots": [
    {
      "shot_id": "shot_01_phone_hook",
      "start": 0.0,
      "end": 4.88,
      "narration": "Ждёшь, пока появится мотивация? Поменяй порядок: сначала — минимальное действие.",
      "caption": "ЖДЁШЬ, ПОКА ПОЯВИТСЯ МОТИВАЦИЯ? / ПОМЕНЯЙ ПОРЯДОК / СНАЧАЛА — МИНИМАЛЬНОЕ ДЕЙСТВИЕ.",
      "visual_intent": "Immediate everyday procrastination hook with a phone at a desk.",
      "asset_id": "asset_phone_desk",
      "source_in": 0.0,
      "source_out": 4.88,
      "claim_ids": [],
      "transition": "hard_cut"
    },
    {
      "shot_id": "shot_02_intention_setup",
      "start": 4.88,
      "end": 9.88,
      "narration": "У ожидания есть проблема: намерение само по себе ещё не гарантирует действие.",
      "caption": "У ОЖИДАНИЯ ЕСТЬ ПРОБЛЕМА / НАМЕРЕНИЕ САМО ПО СЕБЕ ЕЩЁ НЕ ГАРАНТИРУЕТ ДЕЙСТВИЕ.",
      "visual_intent": "Handwritten planning illustrates intention without implying completion.",
      "asset_id": "asset_todo_list",
      "source_in": 0.0,
      "source_out": 5.0,
      "claim_ids": ["clm_intention_not_action"],
      "transition": "hard_cut"
    },
    {
      "shot_id": "shot_03_reduce_entry",
      "start": 9.88,
      "end": 16.36,
      "narration": "Поэтому не пытайся захотеть всю задачу. Сделай вход настолько маленьким, чтобы начать без нужного настроения.",
      "caption": "ПОЭТОМУ НЕ ПЫТАЙСЯ ЗАХОТЕТЬ ВСЮ ЗАДАЧУ / СДЕЛАЙ ВХОД НАСТОЛЬКО МАЛЕНЬКИМ / ЧТОБЫ НАЧАТЬ БЕЗ НУЖНОГО НАСТРОЕНИЯ.",
      "visual_intent": "Continue the list footage while reframing the task into a smaller entry action.",
      "asset_id": "asset_todo_list",
      "source_in": 2.2,
      "source_out": 8.68,
      "claim_ids": [],
      "transition": "hard_cut"
    },
    {
      "shot_id": "shot_04_shoes",
      "start": 16.36,
      "end": 19.44,
      "narration": "Не «тренироваться час», а надеть кроссовки.",
      "caption": "НЕ ТРЕНИРОВАТЬСЯ ЧАС — А НАДЕТЬ КРОССОВКИ.",
      "visual_intent": "Literal minimal exercise-start example.",
      "asset_id": "asset_put_on_shoe",
      "source_in": 0.4,
      "source_out": 3.48,
      "claim_ids": [],
      "transition": "hard_cut"
    },
    {
      "shot_id": "shot_05_document",
      "start": 19.44,
      "end": 22.04,
      "narration": "Не «написать статью», а открыть документ.",
      "caption": "НЕ НАПИСАТЬ СТАТЬЮ — А ОТКРЫТЬ ДОКУМЕНТ.",
      "visual_intent": "Laptop work illustrates opening the document and beginning.",
      "asset_id": "asset_typing_coffee",
      "source_in": 0.4,
      "source_out": 3.0,
      "claim_ids": [],
      "transition": "hard_cut"
    },
    {
      "shot_id": "shot_06_one_item",
      "start": 22.04,
      "end": 24.96,
      "narration": "Не «разобрать квартиру», а убрать одну вещь.",
      "caption": "НЕ РАЗОБРАТЬ КВАРТИРУ — А УБРАТЬ ОДНУ ВЕЩЬ.",
      "visual_intent": "Literal one-item declutter example.",
      "asset_id": "asset_tidy_desk",
      "source_in": 1.2,
      "source_out": 4.12,
      "claim_ids": [],
      "transition": "hard_cut"
    },
    {
      "shot_id": "shot_07_signal_plan",
      "start": 24.96,
      "end": 35.72,
      "narration": "Затем привяжи старт к сигналу: «Когда поставлю кружку после завтрака, открою документ и поработаю две минуты».",
      "caption": "ЗАТЕМ ПРИВЯЖИ СТАРТ К СИГНАЛУ / КОГДА ПОСТАВЛЮ КРУЖКУ ПОСЛЕ ЗАВТРАКА / ОТКРОЮ ДОКУМЕНТ И ПОРАБОТАЮ ДВЕ МИНУТЫ.",
      "visual_intent": "Sticky notes make the cue-action plan concrete.",
      "asset_id": "asset_sticky_note",
      "source_in": 0.5,
      "source_out": 11.26,
      "claim_ids": ["clm_if_then_may_help"],
      "transition": "hard_cut"
    },
    {
      "shot_id": "shot_08_claim_boundary",
      "start": 35.72,
      "end": 40.24,
      "narration": "Планы «если — то» могут облегчать переход от намерения к началу. Но это инструмент, а не гарантия.",
      "caption": "ПЛАНЫ «ЕСЛИ — ТО» МОГУТ ОБЛЕГЧАТЬ ПЕРЕХОД ОТ НАМЕРЕНИЯ К НАЧАЛУ / НО ЭТО ИНСТРУМЕНТ, А НЕ ГАРАНТИЯ.",
      "visual_intent": "Focused work footage supports the bounded claim without implying guaranteed success.",
      "asset_id": "asset_typing_coffee",
      "source_in": 2.0,
      "source_out": 6.52,
      "claim_ids": ["clm_if_then_may_help"],
      "transition": "hard_cut"
    },
    {
      "shot_id": "shot_09_timer",
      "start": 40.24,
      "end": 43.32,
      "narration": "После двух минут можно остановиться. Цель первого шага — не закончить всё, а начать.",
      "caption": "ПОСЛЕ ДВУХ МИНУТ МОЖНО ОСТАНОВИТЬСЯ / ЦЕЛЬ ПЕРВОГО ШАГА — НЕ ЗАКОНЧИТЬ ВСЁ.",
      "visual_intent": "Clock and shoes externalize the editorial two-minute start device.",
      "asset_id": "asset_shoes_clock",
      "source_in": 0.1,
      "source_out": 3.18,
      "claim_ids": [],
      "transition": "hard_cut"
    },
    {
      "shot_id": "shot_10_completion_permission",
      "start": 43.32,
      "end": 49.28,
      "narration": "Если продолжишь — отлично. Если нет — план всё равно выполнен.",
      "caption": "А НАЧАТЬ / ЕСЛИ ПРОДОЛЖИШЬ — ОТЛИЧНО / ЕСЛИ НЕТ — ПЛАН ВСЁ РАВНО ВЫПОЛНЕН.",
      "visual_intent": "Return to calm work while removing pressure to finish the whole task.",
      "asset_id": "asset_typing_coffee",
      "source_in": 0.2,
      "source_out": 6.16,
      "claim_ids": [],
      "transition": "hard_cut"
    },
    {
      "shot_id": "shot_11_call_to_action",
      "start": 49.28,
      "end": 53.7,
      "narration": "Не жди идеального состояния. Выбери минимальный шаг и сделай его сейчас. Напиши: «Мой шаг — …»",
      "caption": "НЕ ЖДИ ИДЕАЛЬНОГО СОСТОЯНИЯ / ВЫБЕРИ МИНИМАЛЬНЫЙ ШАГ / И СДЕЛАЙ ЕГО СЕЙЧАС / НАПИШИ: МОЙ ШАГ — …",
      "visual_intent": "Closing movement and declutter action carry the viewer into an immediate CTA.",
      "asset_id": "asset_tidy_desk",
      "source_in": 7.6,
      "source_out": 12.02,
      "claim_ids": [],
      "transition": "hard_cut"
    }
  ]
}
